{"schema":"openjev-bench-v1","state_file":"fixtures/bench/long-state.txt","state_sha256":"640e00e325f9125d659f4ca633b04bfc08e314823057b5e89c4299d3f5a2a41b","state_bytes":8068,"questions_file":"fixtures/bench/questions21.jsonl","questions_sha256":"311424c1de23864b1ef21dd5fb5010aec0524727d59ce89d83827fd1cc488e55","questions":21,"repeats":5,"warmup":"one untimed direct decision after one model load","model_load_seconds":1.3142563329999999,"model":{"id":"qwen3-0.6b","source":"Qwen/Qwen3-0.6B-GGUF","revision":"23749fefcc72300e3a2ad315e1317431b06b590a","file":"Qwen3-0.6B-Q8_0.gguf","quant":"Q8_0","backend":"llama-cpp-2/0.1.156 llama.cpp/e79e4bf660e19f2ad851e06c6913f7a8c5852621","artifact_sha256":"9465e63a22add5354d9bb4b99e90117043c7124007664907259bd16d043bb031","integrity":"manifest-sha256","dtype":"GGUF quantized/mixed Q8_0","native_reference":{"source":"Qwen/Qwen3-0.6B","revision":"c1899de289a04d12100db370d81485cdf75e47ca","dtype":"bfloat16"},"template_profile":"qwen3","template_sha256":"57f1fd00f0013a2be96aa79b857391f27e23df5b5f847072b524c897e24d0361","template_override":false,"template_status":"reviewed-equivalent","template_equivalence_evidence":"fixtures/qwen-template-equivalence.json; scope=two string messages (system then user), no tools, add_generation_prompt=true, enable_thinking=false; artifact_sha256=9465e63a22add5354d9bb4b99e90117043c7124007664907259bd16d043bb031; gguf_template_sha256=57f1fd00f0013a2be96aa79b857391f27e23df5b5f847072b524c897e24d0361; native_profile_sha256=a55ee1b1660128b7098723e0abcd92caa0788061051c62d51cbe87d9cf1974d8","serving_config":"llama-direct-v1","adapter":null,"adapter_sha256":null,"adapter_revision":null},"execution":{"requested_mode":"direct","effective_mode":"direct","fallback_reason":null,"device":"metal","device_name":"MTL0: Apple M3 Pro (MTL)","gpu_layers_requested":"all","gpu_layers_actual":null,"gpu_layers_status":"unavailable","threads":11,"n_ctx_requested":null,"n_ctx_actual":4096,"max_tokens":4096,"n_batch":512,"n_ubatch":512,"n_seq_max":1,"kv_unified":true,"waves":1,"probe_id":null,"run_id":"openjev-18174-1"},"configuration":{"device":"metal","gpu_layers_requested":"all","threads":11,"n_ctx_requested":null,"max_tokens":4096,"max_context_tokens":32768,"n_batch":512,"n_ubatch":512,"max_sequences":32,"offline":true,"compiled_features":{"native":true,"metal":true,"cuda":false}},"host":{"os":"26.2","kernel":"Darwin 25.2.0 Darwin Kernel Version 25.2.0: Tue Nov 18 21:09:45 PST 2025; root:xnu-12377.61.12~1/RELEASE_ARM64_T6030 arm64 arm","cpu":"Apple M3 Pro","ram_bytes":19327352832,"gpu":"Graphics/Displays:\n\n    Apple M3 Pro:\n\n      Chipset Model: Apple M3 Pro\n      Type: GPU\n      Bus: Built-In\n      Total Number of Cores: 14\n      Vendor: Apple (0x106b)\n      Metal Support: Metal 4\n      Displays:\n        Color LCD:\n          Display Type: Built-in Liquid Retina XDR Display\n          Resolution: 3024 x 1964 Retina\n          Main Display: Yes\n          Mirror: Off\n          Online: Yes\n          Automatically Adjust Brightness: Yes\n          Display Asleep: Yes\n          Connection Type: Internal","rustc":"rustc 1.95.0 (59807616e 2026-04-14)","cargo":"cargo 1.95.0 (f2d3ce0bd 2026-03-21)"},"native_sha":"llama-cpp-2/0.1.156 llama.cpp/e79e4bf660e19f2ad851e06c6913f7a8c5852621","direct":{"samples":5,"median_seconds":13.19605275,"p95_seconds":13.711817083,"median_decisions_per_second":1.591384969266662},"requested_shared":{"samples":5,"median_seconds":13.219937958,"p95_seconds":13.241242875,"median_decisions_per_second":1.5885097242299782},"shared_speedup":null,"shared_gate_failure":"cache receipt failed: probe receipt is not a passing exact model/configuration match","samples":[{"repeat":0,"order_in_repeat":1,"requested_mode":"direct","effective_mode":"direct","fallback_reason":null,"probe_id":null,"group_wall_seconds":13.14110975,"decisions":21,"decisions_per_second":1.5980385522615395,"input_tokens_sum":36312,"prefix_tokens":null,"true_suffix_tokens":null,"encoder_seconds":null,"context_seconds":null,"forward_seconds_sum":11.169075166999999,"shared_group_forward_seconds":null},{"repeat":0,"order_in_repeat":2,"requested_mode":"shared","effective_mode":"serial","fallback_reason":"cache receipt failed: probe receipt is not a passing exact model/configuration match","probe_id":null,"group_wall_seconds":13.159406375,"decisions":21,"decisions_per_second":1.5958166654003039,"input_tokens_sum":36312,"prefix_tokens":null,"true_suffix_tokens":null,"encoder_seconds":null,"context_seconds":null,"forward_seconds_sum":11.199508045,"shared_group_forward_seconds":null},{"repeat":1,"order_in_repeat":1,"requested_mode":"shared","effective_mode":"serial","fallback_reason":"cache receipt failed: probe receipt is not a passing exact model/configuration match","probe_id":null,"group_wall_seconds":13.211565167,"decisions":21,"decisions_per_second":1.5895164376476787,"input_tokens_sum":36312,"prefix_tokens":null,"true_suffix_tokens":null,"encoder_seconds":null,"context_seconds":null,"forward_seconds_sum":11.160316914,"shared_group_forward_seconds":null},{"repeat":1,"order_in_repeat":2,"requested_mode":"direct","effective_mode":"direct","fallback_reason":null,"probe_id":null,"group_wall_seconds":13.326384208,"decisions":21,"decisions_per_second":1.575821293475347,"input_tokens_sum":36312,"prefix_tokens":null,"true_suffix_tokens":null,"encoder_seconds":null,"context_seconds":null,"forward_seconds_sum":11.243988291999997,"shared_group_forward_seconds":null},{"repeat":2,"order_in_repeat":1,"requested_mode":"direct","effective_mode":"direct","fallback_reason":null,"probe_id":null,"group_wall_seconds":13.711817083,"decisions":21,"decisions_per_second":1.5315256813071068,"input_tokens_sum":36312,"prefix_tokens":null,"true_suffix_tokens":null,"encoder_seconds":null,"context_seconds":null,"forward_seconds_sum":11.386959292999999,"shared_group_forward_seconds":null},{"repeat":2,"order_in_repeat":2,"requested_mode":"shared","effective_mode":"serial","fallback_reason":"cache receipt failed: probe receipt is not a passing exact model/configuration match","probe_id":null,"group_wall_seconds":13.219937958,"decisions":21,"decisions_per_second":1.5885097242299782,"input_tokens_sum":36312,"prefix_tokens":null,"true_suffix_tokens":null,"encoder_seconds":null,"context_seconds":null,"forward_seconds_sum":11.208035375,"shared_group_forward_seconds":null},{"repeat":3,"order_in_repeat":1,"requested_mode":"shared","effective_mode":"serial","fallback_reason":"cache receipt failed: probe receipt is not a passing exact model/configuration match","probe_id":null,"group_wall_seconds":13.236797417,"decisions":21,"decisions_per_second":1.5864864693804055,"input_tokens_sum":36312,"prefix_tokens":null,"true_suffix_tokens":null,"encoder_seconds":null,"context_seconds":null,"forward_seconds_sum":11.244930708,"shared_group_forward_seconds":null},{"repeat":3,"order_in_repeat":2,"requested_mode":"direct","effective_mode":"direct","fallback_reason":null,"probe_id":null,"group_wall_seconds":13.19605275,"decisions":21,"decisions_per_second":1.591384969266662,"input_tokens_sum":36312,"prefix_tokens":null,"true_suffix_tokens":null,"encoder_seconds":null,"context_seconds":null,"forward_seconds_sum":11.201798334000001,"shared_group_forward_seconds":null},{"repeat":4,"order_in_repeat":1,"requested_mode":"direct","effective_mode":"direct","fallback_reason":null,"probe_id":null,"group_wall_seconds":13.193160416,"decisions":21,"decisions_per_second":1.5917338482849235,"input_tokens_sum":36312,"prefix_tokens":null,"true_suffix_tokens":null,"encoder_seconds":null,"context_seconds":null,"forward_seconds_sum":11.179110458999999,"shared_group_forward_seconds":null},{"repeat":4,"order_in_repeat":2,"requested_mode":"shared","effective_mode":"serial","fallback_reason":"cache receipt failed: probe receipt is not a passing exact model/configuration match","probe_id":null,"group_wall_seconds":13.241242875,"decisions":21,"decisions_per_second":1.58595384120994,"input_tokens_sum":36312,"prefix_tokens":null,"true_suffix_tokens":null,"encoder_seconds":null,"context_seconds":null,"forward_seconds_sum":11.187401458,"shared_group_forward_seconds":null}],"limitations":["Timed group wall excludes model load, warmup, input validation, and output writes.","All scoring uses one owner worker sequentially and one loaded model per process.","A requested-shared serial fallback is measured as the emitted path but is not called a shared speedup.","Per-row native timing is summed only for direct/serial rows; shared group timing is read once and never duplicated across rows."]}
