{"schema":"openjev-bench-v1","state_file":"fixtures/bench/short-state.txt","state_sha256":"d92fab66247850d04f2508f2ebecaa5e116ad502d97153ef74b265dae3227925","state_bytes":703,"questions_file":"fixtures/bench/questions21.jsonl","questions_sha256":"311424c1de23864b1ef21dd5fb5010aec0524727d59ce89d83827fd1cc488e55","questions":21,"repeats":5,"warmup":"one untimed direct decision after one model load","model_load_seconds":4.628585042,"model":{"id":"minicpm5-2b","source":"openbmb/MiniCPM5-2B-GGUF","revision":"2079a22f3beaa4e306449978533478fe0522f4b3","file":"MiniCPM5-2B-Q4_K_M.gguf","quant":"Q4_K_M","backend":"llama-cpp-2/0.1.156 llama.cpp/e79e4bf660e19f2ad851e06c6913f7a8c5852621","artifact_sha256":"ec2d5801640099e97d8d7e8003ad4d81f336e757811f03a26173dddf386602fd","integrity":"manifest-sha256","dtype":"GGUF quantized/mixed Q4_K_M","native_reference":{"source":"openbmb/MiniCPM5-2B","revision":"12a3808a956f869c767195e9266b59c4d21d92e2","dtype":"bfloat16"},"template_profile":"minicpm5","template_sha256":"cc945752db555d60949b16989df4ccfeb52a313d6b4b5c5229dd786e2e9fcf1c","template_override":false,"template_status":"exact","template_equivalence_evidence":null,"serving_config":"llama-direct-v1","adapter":null,"adapter_sha256":null,"adapter_revision":null},"execution":{"requested_mode":"direct","effective_mode":"direct","fallback_reason":null,"device":"cpu","device_name":"CPU: Apple M3 Pro (CPU)","gpu_layers_requested":0,"gpu_layers_actual":0,"gpu_layers_status":"known-disabled","threads":11,"n_ctx_requested":512,"n_ctx_actual":512,"max_tokens":4096,"n_batch":512,"n_ubatch":512,"n_seq_max":1,"kv_unified":true,"waves":1,"probe_id":null,"run_id":"openjev-30618-1"},"configuration":{"device":"cpu","gpu_layers_requested":0,"threads":11,"n_ctx_requested":512,"max_tokens":4096,"max_context_tokens":32768,"n_batch":512,"n_ubatch":512,"max_sequences":32,"offline":true,"compiled_features":{"native":true,"metal":false,"cuda":false}},"host":{"os":"26.2","kernel":"Darwin 25.2.0 Darwin Kernel Version 25.2.0: Tue Nov 18 21:09:45 PST 2025; root:xnu-12377.61.12~1/RELEASE_ARM64_T6030 arm64 arm","cpu":"Apple M3 Pro","ram_bytes":19327352832,"gpu":"Graphics/Displays:\n\n    Apple M3 Pro:\n\n      Chipset Model: Apple M3 Pro\n      Type: GPU\n      Bus: Built-In\n      Total Number of Cores: 14\n      Vendor: Apple (0x106b)\n      Metal Support: Metal 4\n      Displays:\n        Color LCD:\n          Display Type: Built-in Liquid Retina XDR Display\n          Resolution: 3024 x 1964 Retina\n          Main Display: Yes\n          Mirror: Off\n          Online: Yes\n          Automatically Adjust Brightness: Yes\n          Connection Type: Internal","rustc":"rustc 1.95.0 (59807616e 2026-04-14)","cargo":"cargo 1.95.0 (f2d3ce0bd 2026-03-21)"},"native_sha":"llama-cpp-2/0.1.156 llama.cpp/e79e4bf660e19f2ad851e06c6913f7a8c5852621","direct":{"samples":5,"median_seconds":425.680628458,"p95_seconds":865.970622542,"median_decisions_per_second":0.04933275934136612},"requested_shared":{"samples":5,"median_seconds":444.267292042,"p95_seconds":572.206095917,"median_decisions_per_second":0.04726884102468364},"shared_speedup":null,"shared_gate_failure":"cache receipt failed: inspect probe receipt /Users/chrisraethke/.cache/openjev/openjev/probes/823e91a590746c3af37722811ec532725578707733fe2b3fc453dff121422d23.json: No such file or directory (os error 2)","samples":[{"repeat":0,"order_in_repeat":1,"requested_mode":"direct","effective_mode":"direct","fallback_reason":null,"probe_id":null,"group_wall_seconds":425.680628458,"decisions":21,"decisions_per_second":0.04933275934136612,"input_tokens_sum":5007,"prefix_tokens":null,"true_suffix_tokens":null,"encoder_seconds":null,"context_seconds":null,"forward_seconds_sum":425.31132087399993,"shared_group_forward_seconds":null},{"repeat":0,"order_in_repeat":2,"requested_mode":"shared","effective_mode":"serial","fallback_reason":"cache receipt failed: inspect probe receipt /Users/chrisraethke/.cache/openjev/openjev/probes/823e91a590746c3af37722811ec532725578707733fe2b3fc453dff121422d23.json: No such file or directory (os error 2)","probe_id":null,"group_wall_seconds":397.790051459,"decisions":21,"decisions_per_second":0.05279166716959602,"input_tokens_sum":5007,"prefix_tokens":null,"true_suffix_tokens":null,"encoder_seconds":null,"context_seconds":null,"forward_seconds_sum":397.49034904200005,"shared_group_forward_seconds":null},{"repeat":1,"order_in_repeat":1,"requested_mode":"shared","effective_mode":"serial","fallback_reason":"cache receipt failed: inspect probe receipt /Users/chrisraethke/.cache/openjev/openjev/probes/823e91a590746c3af37722811ec532725578707733fe2b3fc453dff121422d23.json: No such file or directory (os error 2)","probe_id":null,"group_wall_seconds":372.899234041,"decisions":21,"decisions_per_second":0.05631548172526164,"input_tokens_sum":5007,"prefix_tokens":null,"true_suffix_tokens":null,"encoder_seconds":null,"context_seconds":null,"forward_seconds_sum":372.55249737599996,"shared_group_forward_seconds":null},{"repeat":1,"order_in_repeat":2,"requested_mode":"direct","effective_mode":"direct","fallback_reason":null,"probe_id":null,"group_wall_seconds":405.207165667,"decisions":21,"decisions_per_second":0.05182534214426464,"input_tokens_sum":5007,"prefix_tokens":null,"true_suffix_tokens":null,"encoder_seconds":null,"context_seconds":null,"forward_seconds_sum":404.81461937499995,"shared_group_forward_seconds":null},{"repeat":2,"order_in_repeat":1,"requested_mode":"direct","effective_mode":"direct","fallback_reason":null,"probe_id":null,"group_wall_seconds":395.5586595,"decisions":21,"decisions_per_second":0.05308947104468585,"input_tokens_sum":5007,"prefix_tokens":null,"true_suffix_tokens":null,"encoder_seconds":null,"context_seconds":null,"forward_seconds_sum":395.199389166,"shared_group_forward_seconds":null},{"repeat":2,"order_in_repeat":2,"requested_mode":"shared","effective_mode":"serial","fallback_reason":"cache receipt failed: inspect probe receipt /Users/chrisraethke/.cache/openjev/openjev/probes/823e91a590746c3af37722811ec532725578707733fe2b3fc453dff121422d23.json: No such file or directory (os error 2)","probe_id":null,"group_wall_seconds":444.267292042,"decisions":21,"decisions_per_second":0.04726884102468364,"input_tokens_sum":5007,"prefix_tokens":null,"true_suffix_tokens":null,"encoder_seconds":null,"context_seconds":null,"forward_seconds_sum":443.8294896230001,"shared_group_forward_seconds":null},{"repeat":3,"order_in_repeat":1,"requested_mode":"shared","effective_mode":"serial","fallback_reason":"cache receipt failed: inspect probe receipt /Users/chrisraethke/.cache/openjev/openjev/probes/823e91a590746c3af37722811ec532725578707733fe2b3fc453dff121422d23.json: No such file or directory (os error 2)","probe_id":null,"group_wall_seconds":572.206095917,"decisions":21,"decisions_per_second":0.036700063403459625,"input_tokens_sum":5007,"prefix_tokens":null,"true_suffix_tokens":null,"encoder_seconds":null,"context_seconds":null,"forward_seconds_sum":571.767741376,"shared_group_forward_seconds":null},{"repeat":3,"order_in_repeat":2,"requested_mode":"direct","effective_mode":"direct","fallback_reason":null,"probe_id":null,"group_wall_seconds":606.932243333,"decisions":21,"decisions_per_second":0.03460023788599104,"input_tokens_sum":5007,"prefix_tokens":null,"true_suffix_tokens":null,"encoder_seconds":null,"context_seconds":null,"forward_seconds_sum":606.271153542,"shared_group_forward_seconds":null},{"repeat":4,"order_in_repeat":1,"requested_mode":"direct","effective_mode":"direct","fallback_reason":null,"probe_id":null,"group_wall_seconds":865.970622542,"decisions":21,"decisions_per_second":0.024250245277785378,"input_tokens_sum":5007,"prefix_tokens":null,"true_suffix_tokens":null,"encoder_seconds":null,"context_seconds":null,"forward_seconds_sum":864.9191979960001,"shared_group_forward_seconds":null},{"repeat":4,"order_in_repeat":2,"requested_mode":"shared","effective_mode":"serial","fallback_reason":"cache receipt failed: inspect probe receipt /Users/chrisraethke/.cache/openjev/openjev/probes/823e91a590746c3af37722811ec532725578707733fe2b3fc453dff121422d23.json: No such file or directory (os error 2)","probe_id":null,"group_wall_seconds":542.332806167,"decisions":21,"decisions_per_second":0.038721611086778865,"input_tokens_sum":5007,"prefix_tokens":null,"true_suffix_tokens":null,"encoder_seconds":null,"context_seconds":null,"forward_seconds_sum":541.6500590799999,"shared_group_forward_seconds":null}],"limitations":["Timed group wall excludes model load, warmup, input validation, and output writes.","All scoring uses one owner worker sequentially and one loaded model per process.","A requested-shared serial fallback is measured as the emitted path but is not called a shared speedup.","Per-row native timing is summed only for direct/serial rows; shared group timing is read once and never duplicated across rows."]}
